Suite/Test/Step Name,Browser,Description,Start time,End time,Duration,Status
08 Inden Kerja - CEK - Perak,Chrome 73.0.3683.103,,2019-04-09 11:39:30,2019-04-09 11:53:30,14m - 0.182s,FAILED
,,,,,,
Test Cases/Perolehan/002 Rekod Baru oleh Penyedia/010 Inden Kerja - CEK,Chrome 73.0.3683.103,this is a test case to create REKOD BARU for Inden Kerja for 7011 env,2019-04-09 11:39:30,2019-04-09 11:41:14,1m - 44.099s,PASSED
"callTestCase(findTestCase(""Perolehan/001 Left Menu Selection/Select Menu Pesanan Tempatan""), [:], STOP_ON_FAILURE)",Chrome 73.0.3683.103,Call test to open menu sisi and then select pesanan tempatan / inden kerja,2019-04-09 11:39:31,2019-04-09 11:40:16,45.109s,PASSED
delay(8),Chrome 73.0.3683.103,,2019-04-09 11:40:16,2019-04-09 11:40:24,8.002s,PASSED
"click(findTestObject(""Perolehan/002 Penyedia_RekodBaru/005 Rekod Baru Inden Kerja/button_Rekod_Baru""))",Chrome 73.0.3683.103,Click Rekod Baru button,2019-04-09 11:40:24,2019-04-09 11:40:24,0.091s,PASSED
delay(3),Chrome 73.0.3683.103,delay,2019-04-09 11:40:24,2019-04-09 11:40:27,3.002s,PASSED
"click(findTestObject(""Perolehan/002 Penyedia_RekodBaru/005 Rekod Baru Inden Kerja/Drop_down_Jenis_Urusniaga""))",Chrome 73.0.3683.103,Click on drop down Jenis Urusniaga,2019-04-09 11:40:27,2019-04-09 11:40:27,0.096s,PASSED
delay(2),Chrome 73.0.3683.103,delay,2019-04-09 11:40:27,2019-04-09 11:40:29,2.005s,PASSED
mydate = new java.util.Date(),Chrome 73.0.3683.103,Get todays year and date,2019-04-09 11:40:29,2019-04-09 11:40:29,0.006s,PASSED
"click(findTestObject(""Perolehan/002 Penyedia_RekodBaru/005 Rekod Baru Inden Kerja/select_INDEN KERJA AUTO""))",Chrome 73.0.3683.103,Select inden kerja auto from the drop down list,2019-04-09 11:40:29,2019-04-09 11:40:29,0.242s,PASSED
"click(findTestObject(""Perolehan/002 Penyedia_RekodBaru/005 Rekod Baru Inden Kerja/Drop_down_Pembekal""))",Chrome 73.0.3683.103,click on drop down nama pembekal,2019-04-09 11:40:29,2019-04-09 11:40:30,0.104s,PASSED
"setText(findTestObject(""Perolehan/002 Penyedia_RekodBaru/007 Rekod Baru Pesanan Tempatan/input_kod_pembekal""), kod_pembekal_cek)",Chrome 73.0.3683.103,input nama pembekal julia competency training in the filter textbox,2019-04-09 11:40:30,2019-04-09 11:40:30,0.492s,PASSED
delay(0),Chrome 73.0.3683.103,,2019-04-09 11:40:30,2019-04-09 11:40:30,0.002s,PASSED
"click(findTestObject(""Perolehan/002 Penyedia_RekodBaru/001 Rekod Baru Pesanan Tempatan/Select_Pembekal"", [""text"":kod_pembekal_cek]))",Chrome 73.0.3683.103,select nama pembekal from the filter result,2019-04-09 11:40:30,2019-04-09 11:40:31,1.134s,PASSED
"click(findTestObject(""Perolehan/002 Penyedia_RekodBaru/005 Rekod Baru Inden Kerja/Date_Picker_Sila_Bekalkan""))",Chrome 73.0.3683.103,click on the calendar date picker for sila bekalkan,2019-04-09 11:40:31,2019-04-09 11:40:31,0.099s,PASSED
delay(3),Chrome 73.0.3683.103,delay,2019-04-09 11:40:31,2019-04-09 11:40:34,3.002s,PASSED
"click(findTestObject(""Perolehan/002 Penyedia_RekodBaru/005 Rekod Baru Inden Kerja/Date_Picker_Next_month""))",Chrome 73.0.3683.103,click next month from the calendar picker,2019-04-09 11:40:34,2019-04-09 11:40:34,0.069s,PASSED
"click(findTestObject(""Perolehan/002 Penyedia_RekodBaru/005 Rekod Baru Inden Kerja/Date_Picker_Select_date_26th""))",Chrome 73.0.3683.103,select date 26th of the month,2019-04-09 11:40:34,2019-04-09 11:40:34,0.066s,PASSED
"setText(findTestObject(""Perolehan/002 Penyedia_RekodBaru/005 Rekod Baru Inden Kerja/input_no_tanggungan""), ""1"")",Chrome 73.0.3683.103,input no tanggungan,2019-04-09 11:40:34,2019-04-09 11:40:34,0.090s,PASSED
"setText(findTestObject(""Perolehan/002 Penyedia_RekodBaru/005 Rekod Baru Inden Kerja/input_amaun_tanggungan""), ""100"")",Chrome 73.0.3683.103,input amaun tanggungan,2019-04-09 11:40:34,2019-04-09 11:40:35,0.096s,PASSED
"setText(findTestObject(""Perolehan/002 Penyedia_RekodBaru/005 Rekod Baru Inden Kerja/input_ringkasan_kerja""), ""ringkasan kerja untuk inden kerja"")",Chrome 73.0.3683.103,input ringkasan kerja,2019-04-09 11:40:35,2019-04-09 11:40:35,0.238s,PASSED
RN = Math.random() * 100000,Chrome 73.0.3683.103,int RN is created to generete random number,2019-04-09 11:40:35,2019-04-09 11:40:35,0.011s,PASSED
"setText(findTestObject(""Perolehan/002 Penyedia_RekodBaru/005 Rekod Baru Inden Kerja/input_rujukan_fail""), ""IK000"" + RN)",Chrome 73.0.3683.103,input rujukan fail as random number that starts with IK00 + RN number,2019-04-09 11:40:35,2019-04-09 11:40:35,0.135s,PASSED
"IKno_rujukan = ""IK00"" + RN",Chrome 73.0.3683.103,get Input Rujukan fail value,2019-04-09 11:40:35,2019-04-09 11:40:35,0.001s,PASSED
println(IKno_rujukan),Chrome 73.0.3683.103,print the value into console for display,2019-04-09 11:40:35,2019-04-09 11:40:35,0.002s,PASSED
"setText(findTestObject(""Perolehan/002 Penyedia_RekodBaru/005 Rekod Baru Inden Kerja/input_kerja_terperinci""), ""kerja terperinci "" + mydate)",Chrome 73.0.3683.103,input kerja terperinci with current date and time stamp,2019-04-09 11:40:35,2019-04-09 11:40:35,0.182s,PASSED
"setText(findTestObject(""Perolehan/002 Penyedia_RekodBaru/005 Rekod Baru Inden Kerja/input_Perihal""), ""test here "" + mydate)",Chrome 73.0.3683.103,input perihal test with current date and time stamp,2019-04-09 11:40:35,2019-04-09 11:40:35,0.159s,PASSED
"click(findTestObject(""Perolehan/002 Penyedia_RekodBaru/005 Rekod Baru Inden Kerja/tambah_maklumat_terperinci""))",Chrome 73.0.3683.103,Click on button add to add maklumat terperinci details,2019-04-09 11:40:35,2019-04-09 11:40:35,0.117s,PASSED
delay(3),Chrome 73.0.3683.103,delay,2019-04-09 11:40:35,2019-04-09 11:40:38,3.003s,PASSED
"click(findTestObject(""Perolehan/002 Penyedia_RekodBaru/001 Rekod Baru Pesanan Tempatan/Drop_down_Vot_Dana""))",Chrome 73.0.3683.103,Click Vot Dana drop down to select a value,2019-04-09 11:40:38,2019-04-09 11:40:39,0.231s,PASSED
delay(3),Chrome 73.0.3683.103,delay,2019-04-09 11:40:39,2019-04-09 11:40:42,3.004s,PASSED
"setText(findTestObject(""Perolehan/002 Penyedia_RekodBaru/007 Rekod Baru Pesanan Tempatan/Input_Vot_Dana""), Vot_dana)",Chrome 73.0.3683.103,set value Vot Dana B31 into the filter for KOD,2019-04-09 11:40:42,2019-04-09 11:40:42,0.202s,PASSED
"click(findTestObject(""Perolehan/002 Penyedia_RekodBaru/001 Rekod Baru Pesanan Tempatan/Select_Vot_Dana"", [""text"":Vot_dana]))",Chrome 73.0.3683.103,Select Vot Dana B31,2019-04-09 11:40:42,2019-04-09 11:40:42,0.099s,PASSED
delay(3),Chrome 73.0.3683.103,,2019-04-09 11:40:42,2019-04-09 11:40:45,3.003s,PASSED
"click(findTestObject(""Perolehan/002 Penyedia_RekodBaru/001 Rekod Baru Pesanan Tempatan/Drop_down_Program_Aktiviti""))",Chrome 73.0.3683.103,Click Program Aktiviti drop down to select a value,2019-04-09 11:40:45,2019-04-09 11:40:45,0.110s,PASSED
"setText(findTestObject(""Perolehan/002 Penyedia_RekodBaru/007 Rekod Baru Pesanan Tempatan/input_Kod_Program_Aktiviti""), kod_program_aktiviti)",Chrome 73.0.3683.103,,2019-04-09 11:40:45,2019-04-09 11:40:45,0.279s,PASSED
"click(findTestObject(""Perolehan/002 Penyedia_RekodBaru/001 Rekod Baru Pesanan Tempatan/Select_Program"", [""text"":kod_program_aktiviti]))",Chrome 73.0.3683.103,Select Program Aktiviti 010080,2019-04-09 11:40:45,2019-04-09 11:40:45,0.119s,PASSED
delay(3),Chrome 73.0.3683.103,,2019-04-09 11:40:45,2019-04-09 11:40:48,3.004s,PASSED
"click(findTestObject(""Perolehan/002 Penyedia_RekodBaru/001 Rekod Baru Pesanan Tempatan/Drop_down_Kod_Akaun""))",Chrome 73.0.3683.103,Click Kod Akaun drop down to select a value,2019-04-09 11:40:48,2019-04-09 11:40:49,0.112s,PASSED
delay(3),Chrome 73.0.3683.103,Delay,2019-04-09 11:40:49,2019-04-09 11:40:52,3.004s,PASSED
"setText(findTestObject(""Perolehan/002 Penyedia_RekodBaru/007 Rekod Baru Pesanan Tempatan/input_kod_Akaun""), kod_akaun_cek)",Chrome 73.0.3683.103,Search for Kod Akaun B0221101,2019-04-09 11:40:52,2019-04-09 11:40:52,0.348s,PASSED
delay(3),Chrome 73.0.3683.103,Delay,2019-04-09 11:40:52,2019-04-09 11:40:55,3.001s,PASSED
"click(findTestObject(""Perolehan/002 Penyedia_RekodBaru/001 Rekod Baru Pesanan Tempatan/Select_Kod_Akaun"", [""text"":kod_akaun_cek]))",Chrome 73.0.3683.103,Select Kod Akaun B0221101,2019-04-09 11:40:55,2019-04-09 11:40:55,0.155s,PASSED
"setText(findTestObject(""Perolehan/002 Penyedia_RekodBaru/005 Rekod Baru Inden Kerja/input_kuantiti""), ""4"")",Chrome 73.0.3683.103,input kuantiti as 4,2019-04-09 11:40:55,2019-04-09 11:40:55,0.130s,PASSED
"setText(findTestObject(""Perolehan/002 Penyedia_RekodBaru/005 Rekod Baru Inden Kerja/input_harga_seunit""), ""1.58"")",Chrome 73.0.3683.103,input harga seunit as 1.58,2019-04-09 11:40:55,2019-04-09 11:40:55,0.236s,PASSED
"click(findTestObject(""Perolehan/002 Penyedia_RekodBaru/005 Rekod Baru Inden Kerja/button_simpan_maklumat_terperinci""))",Chrome 73.0.3683.103,Click on icon simpan maklumat terperinci button,2019-04-09 11:40:55,2019-04-09 11:40:56,0.081s,PASSED
delay(3),Chrome 73.0.3683.103,delay,2019-04-09 11:40:56,2019-04-09 11:40:59,3.004s,PASSED
"click(findTestObject(""Perolehan/002 Penyedia_RekodBaru/005 Rekod Baru Inden Kerja/button_OK_peruntukan_mencukupi""))",Chrome 73.0.3683.103,Click on OK button to close the popup message budget is sufficient ,2019-04-09 11:40:59,2019-04-09 11:40:59,0.072s,PASSED
delay(3),Chrome 73.0.3683.103,,2019-04-09 11:40:59,2019-04-09 11:41:02,3.005s,PASSED
"click(findTestObject(""Perolehan/002 Penyedia_RekodBaru/005 Rekod Baru Inden Kerja/button_Simpan""))",Chrome 73.0.3683.103,Click on Simpan button to save the record,2019-04-09 11:41:02,2019-04-09 11:41:02,0.097s,PASSED
delay(3),Chrome 73.0.3683.103,delay,2019-04-09 11:41:02,2019-04-09 11:41:05,3.004s,PASSED
"click(findTestObject(""Perolehan/002 Penyedia_RekodBaru/005 Rekod Baru Inden Kerja/button_OK_rekod_berjaya_disimpan""))",Chrome 73.0.3683.103,Click on OK button to close the popup message record is saved successfully,2019-04-09 11:41:05,2019-04-09 11:41:05,0.076s,PASSED
"click(findTestObject(""Perolehan/002 Penyedia_RekodBaru/005 Rekod Baru Inden Kerja/button_Senarai_Semak""))",Chrome 73.0.3683.103,Click Senarai semak button to open senarai semak checkbox list,2019-04-09 11:41:05,2019-04-09 11:41:05,0.090s,PASSED
delay(3),Chrome 73.0.3683.103,delay,2019-04-09 11:41:05,2019-04-09 11:41:08,3.003s,PASSED
"check(findTestObject(""Perolehan/002 Penyedia_RekodBaru/005 Rekod Baru Inden Kerja/senarai_semak1""))",Chrome 73.0.3683.103,Check on senarai semak item,2019-04-09 11:41:08,2019-04-09 11:41:08,0.099s,PASSED
"check(findTestObject(""Perolehan/002 Penyedia_RekodBaru/005 Rekod Baru Inden Kerja/senarai_semak2""))",Chrome 73.0.3683.103,Check on senarai semak item,2019-04-09 11:41:08,2019-04-09 11:41:08,0.075s,PASSED
"check(findTestObject(""Perolehan/002 Penyedia_RekodBaru/005 Rekod Baru Inden Kerja/senarai_semak3""))",Chrome 73.0.3683.103,Check on senarai semak item,2019-04-09 11:41:08,2019-04-09 11:41:08,0.070s,PASSED
"click(findTestObject(""Perolehan/002 Penyedia_RekodBaru/005 Rekod Baru Inden Kerja/button_simpan_senarai_semak""))",Chrome 73.0.3683.103,Click simpan senarai semak button to save senarai semak info,2019-04-09 11:41:08,2019-04-09 11:41:08,0.063s,PASSED
"click(findTestObject(""Perolehan/002 Penyedia_RekodBaru/005 Rekod Baru Inden Kerja/button_OK_maklumat_berjaya_disimpan""))",Chrome 73.0.3683.103,Click on OK button to close the popup message recors is saved successfully,2019-04-09 11:41:08,2019-04-09 11:41:09,0.597s,PASSED
"click(findTestObject(""Perolehan/002 Penyedia_RekodBaru/005 Rekod Baru Inden Kerja/button_X_close_senarai_semak""))",Chrome 73.0.3683.103,Click X button on top left to close Senarai Semak screen,2019-04-09 11:41:09,2019-04-09 11:41:09,0.097s,PASSED
"Total = getText(findTestObject(""Perolehan/002 Penyedia_RekodBaru/0022 Sah_Simpan/TotalAmaunPT""))",Chrome 73.0.3683.103,Get the Amaun,2019-04-09 11:41:09,2019-04-09 11:41:09,0.053s,PASSED
println(Total),Chrome 73.0.3683.103,print Total,2019-04-09 11:41:09,2019-04-09 11:41:09,0.000s,PASSED
TotalAmaunPT = Total,Chrome 73.0.3683.103,set global variable value of TotalAmaun with variable Total,2019-04-09 11:41:09,2019-04-09 11:41:09,0.000s,PASSED
"click(findTestObject(""Perolehan/002 Penyedia_RekodBaru/005 Rekod Baru Inden Kerja/button_sah_simpan""))",Chrome 73.0.3683.103,Click sah simpam button to confirm save record,2019-04-09 11:41:09,2019-04-09 11:41:09,0.083s,PASSED
"click(findTestObject(""Perolehan/002 Penyedia_RekodBaru/005 Rekod Baru Inden Kerja/button_Ya_Sah_Simpan""))",Chrome 73.0.3683.103,Click Ya button to confirm action,2019-04-09 11:41:09,2019-04-09 11:41:10,0.588s,PASSED
"PTRekodberjayaID = getText(findTestObject(""Perolehan/002 Penyedia_RekodBaru/005 Rekod Baru Inden Kerja/Rekod_berjaya_No_Rekod""))",Chrome 73.0.3683.103,get value of record id ,2019-04-09 11:41:10,2019-04-09 11:41:10,0.605s,PASSED
println(PTRekodberjayaID),Chrome 73.0.3683.103,print PTRekodberjayaID,2019-04-09 11:41:10,2019-04-09 11:41:10,0.001s,PASSED
PTRekodID = PTRekodberjayaID[(47..61)],Chrome 73.0.3683.103,Take only the PTRekodID value from the get text,2019-04-09 11:41:10,2019-04-09 11:41:10,0.003s,PASSED
println(PTRekodID),Chrome 73.0.3683.103,print the value,2019-04-09 11:41:10,2019-04-09 11:41:10,0.000s,PASSED
PesananTempatanRekodID = PTRekodID,Chrome 73.0.3683.103,set global variable value of PesananTempatanRekodID with variable PTRekodID,2019-04-09 11:41:10,2019-04-09 11:41:10,0.000s,PASSED
delay(3),Chrome 73.0.3683.103,delay,2019-04-09 11:41:10,2019-04-09 11:41:13,3.001s,PASSED
takeScreenshot(),Chrome 73.0.3683.103,take screenshot of the popup message with record id for reference,2019-04-09 11:41:13,2019-04-09 11:41:14,0.343s,PASSED
"waitForElementClickable(findTestObject(""Perolehan/002 Penyedia_RekodBaru/001 Rekod Baru Pesanan Tempatan/button_OK_Rekod_Berjaya_disimpan""), 300)",Chrome 73.0.3683.103,wait for the element to be clickable,2019-04-09 11:41:14,2019-04-09 11:41:14,0.051s,PASSED
"element = findWebElement(findTestObject(""Perolehan/002 Penyedia_RekodBaru/005 Rekod Baru Inden Kerja/button_OK_berjaya_disah_simpan""), 300)",Chrome 73.0.3683.103,declare object to find as an element,2019-04-09 11:41:14,2019-04-09 11:41:14,0.018s,PASSED
"executeJavaScript(""arguments[0].click"", Arrays.asList(element))",Chrome 73.0.3683.103,click on the element using javascript,2019-04-09 11:41:14,2019-04-09 11:41:14,0.043s,PASSED
"click(findTestObject(""Perolehan/002 Penyedia_RekodBaru/005 Rekod Baru Inden Kerja/button_OK_berjaya_disah_simpan""))",Chrome 73.0.3683.103,click OK button to close the popup message,2019-04-09 11:41:14,2019-04-09 11:41:14,0.066s,PASSED
closeBrowser(),Chrome 73.0.3683.103,close browser,2019-04-09 11:41:14,2019-04-09 11:41:14,0.649s,PASSED
,,,,,,
Test Cases/Perolehan/003 Pengesahan Pesanan Tempatan/Pengesahan,Chrome 73.0.3683.103,Penyemak will access the dashboard and semak record,2019-04-09 11:41:14,2019-04-09 11:42:27,1m - 12.578s,PASSED
"openBrowser("""")",Chrome 73.0.3683.103,,2019-04-09 11:41:15,2019-04-09 11:41:17,2.144s,PASSED
navigateToUrl(URL_Homepage),Chrome 73.0.3683.103,,2019-04-09 11:41:17,2019-04-09 11:41:17,0.503s,PASSED
"reusablefunctions.reusablefunctions.Login(PengesahBN, findTestData(""ispekstestdata"").getValue(2, 6))",Chrome 73.0.3683.103,Login into the system,2019-04-09 11:41:17,2019-04-09 11:41:29,11.401s,PASSED
"click(findTestObject(""Perolehan/TukarPeranan/IconTukarPeranan""))",Chrome 73.0.3683.103,Click on icon Tukar Peranan,2019-04-09 11:41:29,2019-04-09 11:41:29,0.102s,PASSED
"click(findTestObject(""Perolehan/TukarPeranan/input_TukarPeranan"", [""value"":RBPengesahBN]))",Chrome 73.0.3683.103,Click Radio Button Penyedia PTJ,2019-04-09 11:41:29,2019-04-09 11:41:29,0.093s,PASSED
"click(findTestObject(""Perolehan/TukarPeranan/button_Ya""))",Chrome 73.0.3683.103,Click Ya to confirm change of role,2019-04-09 11:41:29,2019-04-09 11:41:29,0.072s,PASSED
delay(20),Chrome 73.0.3683.103,,2019-04-09 11:41:29,2019-04-09 11:41:49,20.003s,PASSED
"verifyTextPresent(""Peranan : [Pengesah] Peringkat : [BN]"", false)",Chrome 73.0.3683.103,Verify Peranan is now Penyemak BN,2019-04-09 11:41:49,2019-04-09 11:41:51,2.535s,PASSED
delay(5),Chrome 73.0.3683.103,,2019-04-09 11:41:51,2019-04-09 11:41:57,5.003s,PASSED
"click(findTestObject(""Perolehan/001 Left_Menu_Selection/a_ExpandMenuonLeft""))",Chrome 73.0.3683.103,,2019-04-09 11:41:57,2019-04-09 11:41:57,0.454s,PASSED
"delay(3, STOP_ON_FAILURE)",Chrome 73.0.3683.103,Delay,2019-04-09 11:41:57,2019-04-09 11:42:00,3.003s,PASSED
"click(findTestObject(""Perolehan/001 Left_Menu_Selection/div_PanelTitlePerolehan""))",Chrome 73.0.3683.103,Select Perolehan Sub-menu,2019-04-09 11:42:00,2019-04-09 11:42:00,0.091s,PASSED
"delay(3, STOP_ON_FAILURE)",Chrome 73.0.3683.103,Delay,2019-04-09 11:42:00,2019-04-09 11:42:03,3.004s,PASSED
"click(findTestObject(""Perolehan/001 Left_Menu_Selection/div_PesananTempatan""))",Chrome 73.0.3683.103,Click on Menu sisi,2019-04-09 11:42:03,2019-04-09 11:42:03,0.143s,PASSED
delay(3),Chrome 73.0.3683.103,Pesanan Tempatan page loaded successfully,2019-04-09 11:42:03,2019-04-09 11:42:06,3.003s,PASSED
"setText(findTestObject(""Perolehan/003 Pengesah/input_No_Rekod""), PesananTempatanRekodID)",Chrome 73.0.3683.103,input no record based on global variable value captured during sah simpan,2019-04-09 11:42:06,2019-04-09 11:42:07,0.329s,PASSED
"doubleClick(findTestObject(""Perolehan/003 Pengesah/Senarai_Tugas_Item_No_1"", [""text"":PesananTempatanRekodID]))",Chrome 73.0.3683.103,Select first row from the list of Senarai Tugas,2019-04-09 11:42:07,2019-04-09 11:42:07,0.074s,PASSED
delay(3),Chrome 73.0.3683.103,delay,2019-04-09 11:42:07,2019-04-09 11:42:10,3.003s,PASSED
mydate = new java.util.Date(),Chrome 73.0.3683.103,Get todays year and date,2019-04-09 11:42:10,2019-04-09 11:42:10,0.001s,PASSED
"formattedDate = mydate.format(""dd/MM/yyyy"")",Chrome 73.0.3683.103,Get todays date with format dd/MM/yyyy,2019-04-09 11:42:10,2019-04-09 11:42:10,0.004s,PASSED
"formattedYear = mydate.format(""yyyy"")",Chrome 73.0.3683.103,Get year with format yyyy,2019-04-09 11:42:10,2019-04-09 11:42:10,0.000s,PASSED
println(formattedDate),Chrome 73.0.3683.103,print date in format dd/mm/yy,2019-04-09 11:42:10,2019-04-09 11:42:10,0.000s,PASSED
println(formattedYear),Chrome 73.0.3683.103,print year in format yyyy,2019-04-09 11:42:10,2019-04-09 11:42:10,0.000s,PASSED
"TahunKewangan = getText(findTestObject(""Perolehan/003 Pengesah/Label_tahun_kewangan""))",Chrome 73.0.3683.103,Get Tahun Kewangan from screen,2019-04-09 11:42:10,2019-04-09 11:42:10,0.037s,PASSED
"verifyMatch(TahunKewangan, formattedYear, false)",Chrome 73.0.3683.103,verify tahun kewangan matches current year,2019-04-09 11:42:10,2019-04-09 11:42:10,0.000s,PASSED
"TarikhSemasa = getText(findTestObject(""Perolehan/003 Pengesah/Label_Tarikh_semasa""))",Chrome 73.0.3683.103,Get value of tarikh semasa,2019-04-09 11:42:10,2019-04-09 11:42:10,0.060s,PASSED
"verifyMatch(TarikhSemasa, formattedDate, false)",Chrome 73.0.3683.103,verify tarikh semasa matches system date,2019-04-09 11:42:10,2019-04-09 11:42:10,0.000s,PASSED
delay(3),Chrome 73.0.3683.103,delay,2019-04-09 11:42:10,2019-04-09 11:42:13,3.002s,PASSED
"jumlah = getText(findTestObject(""Perolehan/003 Pengesah/label_Jumlah_pesanan_tempatan""))",Chrome 73.0.3683.103,get jumlah pesanan tempatan value ,2019-04-09 11:42:13,2019-04-09 11:42:13,0.064s,PASSED
println(jumlah),Chrome 73.0.3683.103,print jumlah,2019-04-09 11:42:13,2019-04-09 11:42:13,0.001s,PASSED
"verifyMatch(jumlah, TotalAmaunPT, false)",Chrome 73.0.3683.103,verify that jumlah pesanan tempatan is same as the record created by penyedia,2019-04-09 11:42:13,2019-04-09 11:42:13,0.002s,PASSED
"click(findTestObject(""Perolehan/003 Pengesah/button_sah""))",Chrome 73.0.3683.103,Click on Sah button to sah,2019-04-09 11:42:13,2019-04-09 11:42:13,0.195s,PASSED
delay(3),Chrome 73.0.3683.103,delay,2019-04-09 11:42:13,2019-04-09 11:42:16,3.004s,PASSED
"click(findTestObject(""Perolehan/003 Pengesah/Button_ya_sahkan""))",Chrome 73.0.3683.103,click on Ya to confirm sah,2019-04-09 11:42:16,2019-04-09 11:42:16,0.150s,PASSED
delay(5),Chrome 73.0.3683.103,Delay,2019-04-09 11:42:16,2019-04-09 11:42:21,5.003s,PASSED
"waitForElementClickable(findTestObject(""Perolehan/003 Pengesah/button_OK_berjaya_disah""), 60)",Chrome 73.0.3683.103,wait for the element to become clickable,2019-04-09 11:42:21,2019-04-09 11:42:21,0.049s,PASSED
"waitForElementClickable(findTestObject(""Perolehan/002 Penyedia_RekodBaru/001 Rekod Baru Pesanan Tempatan/button_OK_Rekod_Berjaya_disimpan""), 300)",Chrome 73.0.3683.103,wait for the element to be clickable,2019-04-09 11:42:21,2019-04-09 11:42:21,0.061s,PASSED
"element = findWebElement(findTestObject(""Perolehan/003 Pengesah/button_OK_berjaya_disah""), 300)",Chrome 73.0.3683.103,declare object to find as an element,2019-04-09 11:42:21,2019-04-09 11:42:21,0.032s,PASSED
"executeJavaScript(""arguments[0].click"", Arrays.asList(element))",Chrome 73.0.3683.103,click on the element using javascript,2019-04-09 11:42:21,2019-04-09 11:42:21,0.021s,PASSED
delay(5),Chrome 73.0.3683.103,Delay,2019-04-09 11:42:21,2019-04-09 11:42:26,5.002s,PASSED
"click(findTestObject(""Perolehan/003 Pengesah/button_OK_berjaya_disah""))",Chrome 73.0.3683.103,click on OK to close the prompt after Sah is complete,2019-04-09 11:42:26,2019-04-09 11:42:26,0.074s,PASSED
closeBrowser(),Chrome 73.0.3683.103,close browser,2019-04-09 11:42:26,2019-04-09 11:42:27,0.634s,PASSED
,,,,,,
Test Cases/Perolehan/004 Pelulus Pesanan Tempatan/Pelulus,Chrome 73.0.3683.103,Pelulus will access the dashboard and lulus record,2019-04-09 11:42:27,2019-04-09 11:43:59,1m - 31.577s,PASSED
"openBrowser("""")",Chrome 73.0.3683.103,,2019-04-09 11:42:27,2019-04-09 11:42:30,2.424s,PASSED
navigateToUrl(URL_Homepage),Chrome 73.0.3683.103,,2019-04-09 11:42:30,2019-04-09 11:42:30,0.651s,PASSED
"reusablefunctions.reusablefunctions.Login(PelulusPTJ, findTestData(""ispekstestdata"").getValue(2, 7))",Chrome 73.0.3683.103,Login into the system,2019-04-09 11:42:30,2019-04-09 11:42:42,11.648s,PASSED
"click(findTestObject(""Perolehan/TukarPeranan/IconTukarPeranan""))",Chrome 73.0.3683.103,Click on icon Tukar Peranan,2019-04-09 11:42:42,2019-04-09 11:42:42,0.079s,PASSED
"click(findTestObject(""Perolehan/TukarPeranan/input_TukarPeranan"", [""value"":RBPelulusPTJ]))",Chrome 73.0.3683.103,Click Radio Button Penyedia PTJ,2019-04-09 11:42:42,2019-04-09 11:42:42,0.109s,PASSED
"click(findTestObject(""Perolehan/TukarPeranan/button_Ya""))",Chrome 73.0.3683.103,Click Ya to confirm change of role,2019-04-09 11:42:42,2019-04-09 11:42:42,0.071s,PASSED
delay(20),Chrome 73.0.3683.103,,2019-04-09 11:42:42,2019-04-09 11:43:02,20.003s,PASSED
"verifyTextPresent(""Peranan : [Pelulus] Peringkat : [PTJ]"", false)",Chrome 73.0.3683.103,Verify Peranan is now Pelulus PTJ,2019-04-09 11:43:02,2019-04-09 11:43:05,2.956s,PASSED
delay(5),Chrome 73.0.3683.103,,2019-04-09 11:43:05,2019-04-09 11:43:10,5.002s,PASSED
"click(findTestObject(""Perolehan/001 Left_Menu_Selection/a_ExpandMenuonLeft""))",Chrome 73.0.3683.103,,2019-04-09 11:43:10,2019-04-09 11:43:11,0.466s,PASSED
"delay(3, STOP_ON_FAILURE)",Chrome 73.0.3683.103,Delay,2019-04-09 11:43:11,2019-04-09 11:43:14,3.003s,PASSED
"click(findTestObject(""Perolehan/001 Left_Menu_Selection/div_PanelTitlePerolehan""))",Chrome 73.0.3683.103,Select Perolehan Sub-menu,2019-04-09 11:43:14,2019-04-09 11:43:14,0.086s,PASSED
"delay(3, STOP_ON_FAILURE)",Chrome 73.0.3683.103,Delay,2019-04-09 11:43:14,2019-04-09 11:43:17,3.003s,PASSED
"click(findTestObject(""Perolehan/001 Left_Menu_Selection/div_PesananTempatan""))",Chrome 73.0.3683.103,Click on Menu sisi,2019-04-09 11:43:17,2019-04-09 11:43:17,0.142s,PASSED
delay(3),Chrome 73.0.3683.103,Pesanan Tempatan page loaded successfully,2019-04-09 11:43:17,2019-04-09 11:43:20,3.003s,PASSED
"setText(findTestObject(""Perolehan/004 Pelulus/input_No_Rekod""), PesananTempatanRekodID)",Chrome 73.0.3683.103,input no record based on global variable value captured during sah simpan,2019-04-09 11:43:20,2019-04-09 11:43:20,0.325s,PASSED
"doubleClick(findTestObject(""Perolehan/004 Pelulus/Senarai_Tugas_Item_No_1"", [""text"":PesananTempatanRekodID]))",Chrome 73.0.3683.103,Double click on item no 1 from senarai tugas,2019-04-09 11:43:20,2019-04-09 11:43:20,0.056s,PASSED
delay(3),Chrome 73.0.3683.103,Delay,2019-04-09 11:43:20,2019-04-09 11:43:23,3.002s,PASSED
mydate = new java.util.Date(),Chrome 73.0.3683.103,Get todays year and date,2019-04-09 11:43:23,2019-04-09 11:43:23,0.001s,PASSED
"formattedDate = mydate.format(""dd/MM/yyyy"")",Chrome 73.0.3683.103,Get todays date with format dd/MM/yyyy,2019-04-09 11:43:23,2019-04-09 11:43:23,0.000s,PASSED
"formattedYear = mydate.format(""yyyy"")",Chrome 73.0.3683.103,Get year with format yyyy,2019-04-09 11:43:23,2019-04-09 11:43:23,0.001s,PASSED
println(formattedDate),Chrome 73.0.3683.103,print date in format dd/mm/yy,2019-04-09 11:43:23,2019-04-09 11:43:23,0.000s,PASSED
println(formattedYear),Chrome 73.0.3683.103,print year in format yyyy,2019-04-09 11:43:23,2019-04-09 11:43:23,0.000s,PASSED
"TahunKewangan = getText(findTestObject(""Perolehan/003 Pengesah/Label_tahun_kewangan""))",Chrome 73.0.3683.103,Get Tahun Kewangan from screen,2019-04-09 11:43:23,2019-04-09 11:43:23,0.069s,PASSED
"verifyMatch(TahunKewangan, formattedYear, false)",Chrome 73.0.3683.103,verify tahun kewangan matches current year,2019-04-09 11:43:23,2019-04-09 11:43:23,0.000s,PASSED
"TarikhSemasa = getText(findTestObject(""Perolehan/003 Pengesah/Label_Tarikh_semasa""))",Chrome 73.0.3683.103,Get value of tarikh semasa,2019-04-09 11:43:23,2019-04-09 11:43:24,0.058s,PASSED
"verifyMatch(TarikhSemasa, formattedDate, false)",Chrome 73.0.3683.103,verify tarikh semasa matches system date,2019-04-09 11:43:24,2019-04-09 11:43:24,0.000s,PASSED
delay(20),Chrome 73.0.3683.103,Delay,2019-04-09 11:43:24,2019-04-09 11:43:44,20.002s,PASSED
"jumlah = getText(findTestObject(""Perolehan/003 Pengesah/label_Jumlah_pesanan_tempatan""))",Chrome 73.0.3683.103,get jumlah pesanan tempatan value ,2019-04-09 11:43:44,2019-04-09 11:43:44,0.046s,PASSED
